QuizID,Category,Subtopic,Level,DurationSeconds,QuestionText,OptionA,OptionB,OptionC,OptionD,CorrectAnswer
589452,Science & Innovation,Biology,Hard,1200,What is the unit of electrical inductance?,Coulomb,Henry,Weber,Mho,Henry
589452,Science & Innovation,Biology,Hard,1200,What nucleotide pairs with guanine?,Thymine,Cytosine,Adenine,Uracil,Cytosine
589452,Science & Innovation,Biology,Hard,1200,What is the same in Celsius and Fahrenheit?,-42,-40,32,-39,-40
589452,Science & Innovation,Biology,Hard,1200,Folic acid is the synthetic form of which vitamin?,Vitamin A,Vitamin B,Vitamin C,Vitamin D,Vitamin B
589452,Science & Innovation,Biology,Hard,1200,"What is the scientific name for the extinct hominin known as ""Lucy""?",Australopithecus Afarensis,Australopithecus Africanus,Australopithecus Antaris,Australopithecus Architeuthis,Australopithecus Afarensis
589452,Science & Innovation,Biology,Hard,1200,Which of the following elements is typically used in the doping of the semiconductor silicon?,Iron,Boron,Oxygen,Carbon,Boron
589452,Science & Innovation,Biology,Hard,1200,Which of these is a stop codon in DNA?,ACT,GTA,TAA,ACA,TAA
589452,Science & Innovation,Biology,Hard,1200,The Western Lowland Gorilla is scientifically know as?,Gorilla Gorilla Gorilla,Gorilla Beringei Beringei,Gorilla Beringei Graueri,Gorilla Gorilla Diehli,Gorilla Gorilla Gorilla
589452,Science & Innovation,Biology,Hard,1200,Which of the following is a major muscle of the back?,Trapezium,Trapezius,Trapezoid,Triquetrum,Trapezius
589452,Science & Innovation,Biology,Hard,1200,"In physics, conservation of energy and conservation of momentum are both consequences of which of the following?",Bell's Theorem,Carnot's Theorem,Wick's Theorem,Noether's Theorem,Noether's Theorem
