QuizID,Category,Subtopic,Level,DurationSeconds,QuestionText,OptionA,OptionB,OptionC,OptionD,CorrectAnswer
503860,Business & Finance,Marketing,Hard,1200,"In marketing strategy, Porter's Five Forces model is primarily used to evaluate which aspect of an industry?",Internal organizational structure,Competitive intensity and attractiveness,Consumer purchasing patterns,Product lifecycle stages,B
503860,Business & Finance,Marketing,Hard,1200,Psychographic segmentation in marketing is based on which of the following consumer characteristics?,Age and income levels,Geographic location and climate,"Lifestyle, values, and personality traits",Purchase frequency and brand loyalty,C
503860,Business & Finance,Marketing,Hard,1200,"In digital marketing, a high bounce rate is most indicative of which outcome?",Increased user engagement and interaction,Effective targeting of advertisements,High conversion rates to sales,Users exiting the site shortly after arrival,D
503860,Business & Finance,Marketing,Hard,1200,"According to Aaker's brand equity model, which element is a core component of a brand's value?",Perceived quality and associations,Market share fluctuations,Supply chain efficiency,Competitor pricing strategies,A
503860,Business & Finance,Marketing,Hard,1200,Penetration pricing strategy is most effectively employed under which market condition?,When a product has high brand loyalty,In monopolistic markets with inelastic demand,Entry into a competitive market with price-sensitive consumers,"Launch of a premium, differentiated product",C
503860,Business & Finance,Marketing,Hard,1200,The Theory of Planned Behavior in consumer behavior theory directly incorporates which factors influencing intentions?,Attitudes toward the behavior only,Subjective norms exclusively,Perceived behavioral control alone,"Attitudes, subjective norms, and perceived behavioral control",D
503860,Business & Finance,Marketing,Hard,1200,What is the primary benefit of using conjoint analysis in advanced market research?,Assessing overall brand awareness levels,Determining the relative importance of product attributes,Forecasting long-term economic trends,Evaluating the effectiveness of promotional campaigns,B
503860,Business & Finance,Marketing,Hard,1200,"In integrated marketing communications (IMC), the AIDA model outlines the stages of consumer response as:","Attention, Interest, Desire, Action","Awareness, Involvement, Decision, Advocacy","Analysis, Implementation, Distribution, Evaluation","Attitude, Intention, Adoption, Retention",A
503860,Business & Finance,Marketing,Hard,1200,Greenwashing in marketing ethics refers to the practice of:,Implementing genuine sustainable business practices,Making false or exaggerated environmental claims,Reducing carbon emissions through innovation,Promoting eco-friendly products with transparency,B
503860,Business & Finance,Marketing,Hard,1200,"In global marketing, a standardization strategy typically involves which approach to the marketing mix?",Adapting products and promotions to local cultures,Customizing pricing based on regional economic factors,Applying uniform strategies across international markets,Focusing exclusively on domestic market adaptations,C
