quiz_id,category,title,level,num_questions,duration_seconds,question_order,question_text,options_json,correct_answer,created_at
43095,C++,Programming,easy,10,600,1,Which header file must be included to use the 'cout' object?,"[""<stdio.h>"", ""<iostream>"", ""<stdlib.h>"", ""<string>""]",<iostream>,2025-12-15T14:49:25.491320+00:00
43095,C++,Programming,easy,10,600,2,What is the primary function used as the starting point of execution in a C++ program?,"[""start()"", ""program()"", ""main()"", ""begin()""]",main(),2025-12-15T14:49:25.491320+00:00
43095,C++,Programming,easy,10,600,3,Which operator is used to terminate a statement in C++?,"["":"", "";"", ""."", "",""]",;,2025-12-15T14:49:25.491320+00:00
43095,C++,Programming,easy,10,600,4,What does 'int' define in C++?,"[""A floating-point number"", ""A character literal"", ""An integer data type"", ""A boolean value""]",An integer data type,2025-12-15T14:49:25.491320+00:00
43095,C++,Programming,easy,10,600,5,Which of the following is a correct way to declare an integer variable named 'age' and initialize it to 25?,"[""int age = 25;"", ""age int = 25;"", ""declare int age 25;"", ""integer age = 25;""]",int age = 25;,2025-12-15T14:49:25.491320+00:00
43095,C++,Programming,easy,10,600,6,"In C++, which keyword is used to define a class?","[""struct"", ""object"", ""type"", ""class""]",class,2025-12-15T14:49:25.491320+00:00
43095,C++,Programming,easy,10,600,7,What is the output operator in C++ used with 'cout'?,"["">>"", ""<<"", ""=="", ""++""]",<<,2025-12-15T14:49:25.491320+00:00
43095,C++,Programming,easy,10,600,8,Which operator is used for dynamic memory allocation in C++?,"[""malloc"", ""new"", ""alloc"", ""create""]",new,2025-12-15T14:49:25.491320+00:00
43095,C++,Programming,easy,10,600,9,Which statement is used to execute a block of code repeatedly as long as a condition is true?,"[""if"", ""switch"", ""while"", ""goto""]",while,2025-12-15T14:49:25.491320+00:00
43095,C++,Programming,easy,10,600,10,What does 'std::' refer to when used before standard C++ elements like 'cout'?,"[""Standard Input Device"", ""Standard Library Namespace"", ""Start Definition"", ""Static Data""]",Standard Library Namespace,2025-12-15T14:49:25.491320+00:00
68273,C++,program,easy,10,600,1,What function serves as the entry point for execution in a standard C++ program?,"[""start()"", ""program()"", ""main()"", ""begin()""]",main(),2025-12-16T09:29:04.970837+00:00
68273,C++,program,easy,10,600,2,Which directive is used to include external libraries or header files in C++?,"[""#include"", ""#import"", ""#link"", ""#get""]",#include,2025-12-16T09:29:04.970837+00:00
68273,C++,program,easy,10,600,3,Which operator is typically used for outputting data to the console (standard output) when using the `iostream` library?,"[""<< (Insertion operator)"", "">> (Extraction operator)"", ""&& (Logical AND)"", ""|| (Logical OR)""]",<< (Insertion operator),2025-12-16T09:29:04.970837+00:00
68273,C++,program,easy,10,600,4,What is the standard data type used to store positive or negative whole numbers (integers)?,"[""float"", ""char"", ""int"", ""double""]",int,2025-12-16T09:29:04.970837+00:00
68273,C++,program,easy,10,600,5,Which symbol is used to mark the end of most statements in C++?,"["": (Colon)"", "", (Comma)"", ""; (Semicolon)"", "". (Period)""]",; (Semicolon),2025-12-16T09:29:04.970837+00:00
68273,C++,program,easy,10,600,6,What notation represents a single-line comment in C++?,"[""##"", ""/*"", ""//"", ""--""]",//,2025-12-16T09:29:04.970837+00:00
68273,C++,program,easy,10,600,7,The `cout` object belongs to which standard namespace?,"[""main"", ""std"", ""system"", ""io""]",std,2025-12-16T09:29:04.970837+00:00
68273,C++,program,easy,10,600,8,Which keyword is used to declare a variable that can store only the value 'true' or 'false'?,"[""integer"", ""boolean"", ""bool"", ""char""]",bool,2025-12-16T09:29:04.970837+00:00
68273,C++,program,easy,10,600,9,"In C++, what process converts the source code (.cpp file) into an executable program?","[""Debugging"", ""Interpretation"", ""Compilation"", ""Execution""]",Compilation,2025-12-16T09:29:04.970837+00:00
68273,C++,program,easy,10,600,10,Which of the following characters is NOT allowed as the first character of a variable name in C++?,"[""Uppercase letter (A)"", ""Underscore (_)"", ""Lowercase letter (a)"", ""Digit (1)""]",Digit (1),2025-12-16T09:29:04.970837+00:00
98132,crypto,sha1,easy,10,600,1,What does the acronym SHA stand for in the context of SHA-1?,"[""Standard Hiding Application"", ""Secure Hash Array"", ""Secure Hash Algorithm"", ""System Hardware Access""]",Secure Hash Algorithm,2025-12-16T09:33:16.788067+00:00
98132,crypto,sha1,easy,10,600,2,"What is the fixed output size of a standard SHA-1 hash, measured in bits?","[""128 bits"", ""160 bits"", ""256 bits"", ""512 bits""]",160 bits,2025-12-16T09:33:16.788067+00:00
98132,crypto,sha1,easy,10,600,3,SHA-1 is an example of which type of cryptographic function?,"[""Block Cipher"", ""Public Key Cryptography"", ""Stream Cipher"", ""Cryptographic Hash Function""]",Cryptographic Hash Function,2025-12-16T09:33:16.788067+00:00
98132,crypto,sha1,easy,10,600,4,What property is a hash function like SHA-1 primarily designed to ensure in data?,"[""Confidentiality"", ""Integrity"", ""Availability"", ""Authentication""]",Integrity,2025-12-16T09:33:16.788067+00:00
98132,crypto,sha1,easy,10,600,5,"If you input the exact same data into the SHA-1 algorithm twice, what will the output be?","[""A slightly different hash each time due to salting"", ""The same hash every time"", ""A longer hash the second time"", ""An error message""]",The same hash every time,2025-12-16T09:33:16.788067+00:00
98132,crypto,sha1,easy,10,600,6,How many hexadecimal characters long is a 160-bit SHA-1 hash output?,"[""32"", ""40"", ""64"", ""128""]",40,2025-12-16T09:33:16.788067+00:00
98132,crypto,sha1,easy,10,600,7,Is SHA-1 considered a one-way function?,"[""No, it can be easily reversed using a key"", ""Yes, it is computationally infeasible to derive the input from the output"", ""Yes, but only for inputs shorter than 64 characters"", ""No, it is a two-way function used for encryption""]","Yes, it is computationally infeasible to derive the input from the output",2025-12-16T09:33:16.788067+00:00
98132,crypto,sha1,easy,10,600,8,Why is SHA-1 no longer recommended for new applications like digital signatures?,"[""It requires too much processing power"", ""It is proprietary technology"", ""It is vulnerable to dictionary attacks"", ""It is vulnerable to collision attacks""]",It is vulnerable to collision attacks,2025-12-16T09:33:16.788067+00:00
98132,crypto,sha1,easy,10,600,9,"Which standard hash algorithm is a common, more secure replacement for SHA-1?","[""MD5"", ""RSA"", ""DES"", ""SHA-256""]",SHA-256,2025-12-16T09:33:16.788067+00:00
98132,crypto,sha1,easy,10,600,10,What term describes the situation where two different input messages produce the exact same SHA-1 output?,"[""Decryption"", ""Collision"", ""Salting"", ""Key Stretching""]",Collision,2025-12-16T09:33:16.788067+00:00
39186,crypto,group and terminologies,easy,10,600,1,What is the primary technology underpinning cryptocurrencies like Bitcoin?,"[""Artificial Intelligence"", ""Blockchain"", ""Quantum Computing"", ""Cloud Storage""]",Blockchain,2025-12-16T10:32:11.461014+00:00
39186,crypto,group and terminologies,easy,10,600,2,What cryptographic component is kept secret by the owner and used to authorize transactions?,"[""Public Key"", ""Wallet Address"", ""Private Key"", ""Hashing Algorithm""]",Private Key,2025-12-16T10:32:11.461014+00:00
39186,crypto,group and terminologies,easy,10,600,3,What term is used to describe the very first block recorded on a blockchain?,"[""Zero Block"", ""Start Block"", ""Genesis Block"", ""Initial Block""]",Genesis Block,2025-12-16T10:32:11.461014+00:00
39186,crypto,group and terminologies,easy,10,600,4,"In Proof-of-Work systems, what is the process of solving computational problems to validate transactions and add new blocks?","[""Staking"", ""Burning"", ""Mining"", ""Forfeit""]",Mining,2025-12-16T10:32:11.461014+00:00
39186,crypto,group and terminologies,easy,10,600,5,What is a digital or hardware application used to securely store the private keys required to access cryptocurrency funds?,"[""Browser"", ""Database"", ""Wallet"", ""Exchange""]",Wallet,2025-12-16T10:32:11.461014+00:00
39186,crypto,group and terminologies,easy,10,600,6,"What is the common acronym used in the crypto community that means to purchase and hold assets long-term, typically derived from a typing error for 'hold'?","[""FUD"", ""FOMO"", ""HODL"", ""SELL""]",HODL,2025-12-16T10:32:11.461014+00:00
39186,crypto,group and terminologies,easy,10,600,7,What is the fee required to execute a transaction or run a smart contract on networks like Ethereum?,"[""Gas"", ""Rent"", ""Tithe"", ""Dividend""]",Gas,2025-12-16T10:32:11.461014+00:00
39186,crypto,group and terminologies,easy,10,600,8,"What is the term for traditional, government-issued currency (like USD or EUR) when referenced within the cryptocurrency ecosystem?","[""Stablecoin"", ""Token"", ""Fiat"", ""CBDC""]",Fiat,2025-12-16T10:32:11.461014+00:00
39186,crypto,group and terminologies,easy,10,600,9,What is the term for the globally distributed computers that maintain and secure the decentralized ledger?,"[""Servers"", ""Nodes"", ""Central Hubs"", ""Modems""]",Nodes,2025-12-16T10:32:11.461014+00:00
39186,crypto,group and terminologies,easy,10,600,10,"What core concept describes the decentralized nature of blockchain, where verification relies on cryptography rather than reliance on a single authority?","[""Centralization"", ""KYC"", ""Trustlessness"", ""Proof-of-Authority""]",Trustlessness,2025-12-16T10:32:11.461014+00:00
69860,Artificial Intelligence,Basic Concepts of AI,easy,5,300,1,Which term is defined as the theory and development of computer systems able to perform tasks normally requiring human intelligence?,"[""Database Management"", ""Artificial Intelligence"", ""Virtual Reality"", ""Data Encoding""]",Artificial Intelligence,2025-12-17T14:24:12.506423+00:00
69860,Artificial Intelligence,Basic Concepts of AI,easy,5,300,2,What is the primary goal of Strong AI (or AGI - Artificial General Intelligence)?,"[""To solve one specific, narrow task efficiently"", ""To manage large datasets"", ""To match or exceed human cognitive abilities across all tasks"", ""To optimize web server performance""]",To match or exceed human cognitive abilities across all tasks,2025-12-17T14:24:12.506423+00:00
69860,Artificial Intelligence,Basic Concepts of AI,easy,5,300,3,"AI systems designed to perform a single, specific task (like playing chess or identifying images) fall under which category?","[""Superintelligence"", ""Artificial General Intelligence (AGI)"", ""Artificial Narrow Intelligence (ANI)"", ""Theoretical Intelligence""]",Artificial Narrow Intelligence (ANI),2025-12-17T14:24:12.506423+00:00
69860,Artificial Intelligence,Basic Concepts of AI,easy,5,300,4,Which of the following technologies is a core component used to teach AI systems by providing data and examples?,"[""Machine Learning"", ""Cloud Computing"", ""Operating System"", ""Quantum Entanglement""]",Machine Learning,2025-12-17T14:24:12.506423+00:00
69860,Artificial Intelligence,Basic Concepts of AI,easy,5,300,5,"If a machine passes the Turing Test, what has it successfully demonstrated?","[""The ability to compute complex algorithms quickly"", ""The ability to generate realistic graphics"", ""The ability to exhibit behavior indistinguishable from that of a human being"", ""The ability to connect to the internet reliably""]",The ability to exhibit behavior indistinguishable from that of a human being,2025-12-17T14:24:12.506423+00:00
40356,Object Oriented Programming,OOPS Concepts,medium,5,300,1,Which OOPS concept binds data (attributes) and methods (behavior) together into a single unit and prevents direct access to the data from outside the unit?,"[""Encapsulation"", ""Polymorphism"", ""Inheritance"", ""Abstraction""]",Encapsulation,2025-12-17T19:12:27.232795+00:00
40356,Object Oriented Programming,OOPS Concepts,medium,5,300,2,"In object-oriented design, what is the primary purpose of an abstract class?","[""To be instantiated as a concrete object directly."", ""To provide a complete implementation that cannot be overridden by subclasses."", ""To define a common interface and possibly some base implementation for derived classes."", ""To strictly limit memory allocation for its derived objects.""]",To define a common interface and possibly some base implementation for derived classes.,2025-12-17T19:12:27.232795+00:00
40356,Object Oriented Programming,OOPS Concepts,medium,5,300,3,Method Overloading (compile-time polymorphism) requires methods to have the same name but differ in what aspect?,"[""Return type only."", ""Access modifier only."", ""The number or type of their parameters."", ""The use of the 'virtual' keyword.""]",The number or type of their parameters.,2025-12-17T19:12:27.232795+00:00
40356,Object Oriented Programming,OOPS Concepts,medium,5,300,4,"Which principle suggests that software entities (classes, modules, functions, etc.) should be open for extension, but closed for modification?","[""Liskov Substitution Principle (LSP)"", ""Interface Segregation Principle (ISP)"", ""Open/Closed Principle (OCP)"", ""Dependency Inversion Principle (DIP)""]",Open/Closed Principle (OCP),2025-12-17T19:12:27.232795+00:00
40356,Object Oriented Programming,OOPS Concepts,medium,5,300,5,"What is the relationship between a base class and a derived class called, allowing the derived class to reuse or extend the attributes and behaviors of the base class?","[""Composition (Has-A relationship)"", ""Association"", ""Inheritance (Is-A relationship)"", ""Aggregation""]",Inheritance (Is-A relationship),2025-12-17T19:12:27.232795+00:00
